{
  "schema_version": 1,
  "reviewed_at_utc": "2026-05-09T00:00:00Z",
  "reference": {
    "repo": "IntersectMBO/cardano-node",
    "tag": "11.0.1",
    "local_root": ".reference-haskell-cardano-node",
    "verified_by": [
      "git -C .reference-haskell-cardano-node describe --tags --exact-match HEAD",
      "bash -lc '.reference-haskell-cardano-node/install/bin/cardano-node --version'"
    ],
    "note": "The vendored .reference-haskell-cardano-node/install/ may lag the policy tag while a fresh checkout is in progress. Run scripts/setup-reference.sh to bring it up to the policy tag before relying on byte-equivalence claims."
  },
  "status_legend": {
    "verified_11_0_1": "Implemented and validated against the pinned 11.0.1 reference (forensic byte-equivalence, golden vectors, or live-rehearsal evidence).",
    "implemented_needs_11_0_1_evidence": "Rust behavior exists and local tests pass, but live or golden 11.0.1 parity evidence is still required.",
    "partial": "Only a subset of the Haskell behavior exists; remaining work is listed explicitly.",
    "absent": "No production implementation exists for the parity target."
  },
  "entries": [
    {
      "id": "consensus.praos.leader-check",
      "area": "consensus",
      "feature": "Praos / TPraos slot leader election: VRF input construction, ActiveSlotCoeff, deterministic leader-value comparison",
      "status": "implemented_needs_11_0_1_evidence",
      "next_milestone": "R267",
      "haskell_reference": [
        {
          "path": ".reference-haskell-cardano-node/deps/ouroboros-consensus/ouroboros-consensus-protocol/src/ouroboros-consensus-protocol/Ouroboros/Consensus/Protocol/Praos.hs",
          "role": "Top-level Praos protocol entry points (checkIsLeader, validateVRFSignature)."
        },
        {
          "path": ".reference-haskell-cardano-node/deps/ouroboros-consensus/ouroboros-consensus-protocol/src/ouroboros-consensus-protocol/Ouroboros/Consensus/Protocol/Praos/VRF.hs",
          "role": "VRF input construction (mkInputVRF) and leader-value range extension."
        },
        {
          "path": ".reference-haskell-cardano-node/deps/cardano-ledger/libs/cardano-ledger-core/src/Cardano/Ledger/BaseTypes.hs",
          "role": "ActiveSlotCoeff source-of-truth and deterministic Taylor-series math."
        }
      ],
      "rust_surface": [
        {
          "path": "crates/consensus/src/praos.rs",
          "role": "Top-level leader-check entry points (check_leader_value, check_is_leader, verify_*_proof)."
        },
        {
          "path": "crates/consensus/src/praos/vrf.rs",
          "role": "VrfMode / VrfUsage enums + praos_vrf_input / tpraos_vrf_seed / vrf_input."
        },
        {
          "path": "crates/consensus/src/praos/common.rs",
          "role": "ActiveSlotCoeff struct + leadership_threshold + taylor_exp_cmp."
        }
      ],
      "implemented_evidence": [
        "R273a split praos.rs (793 lines) into praos/{vrf,common}.rs sub-modules mirroring upstream Praos/VRF and Cardano.Ledger.BaseTypes layout.",
        "12-item public surface (ActiveSlotCoeff, VrfMode, VrfUsage, check_is_leader, check_leader_value, leadership_threshold, praos_vrf_input, tpraos_vrf_seed, verify_leader_proof, verify_leader_proof_output, verify_nonce_proof, vrf_input) preserved unchanged.",
        "All four cargo gates green (fmt --check, check-all, lint, test-all) with 4,855 tests passing."
      ],
      "remaining_work": [
        "R266 step 3: forensic per-builtin CEK trace comparison vs upstream db-analyser to close the preview Plutus V2 budget gap (slot 1,462,057, tx 7bb40e40...3be5b9, 306,309 CPU drift).",
        "R267: 24h+ mainnet endurance side-by-side with upstream cardano-node 11.0.1 to certify VRF leader checks across an epoch boundary."
      ],
      "acceptance": [
        "Forensic per-builtin trace matches upstream byte-for-byte for the failing tx.",
        "24h mainnet endurance: zero leader-check divergence vs upstream cardano-node 11.0.1 across at least one full epoch.",
        "Per-100-epoch ledger-hash byte-match on mainnet + preprod + preview."
      ]
    },
    {
      "id": "consensus.nonce.evolution",
      "area": "consensus",
      "feature": "Epoch nonce evolution state machine (UPDN per-block + TICKN epoch-boundary)",
      "status": "implemented_needs_11_0_1_evidence",
      "next_milestone": "R267",
      "haskell_reference": [
        {
          "path": ".reference-haskell-cardano-node/deps/cardano-ledger/libs/cardano-protocol-tpraos/src/Cardano/Protocol/TPraos/Rules/Updn.hs",
          "role": "UPDN rule: per-block evolving / candidate nonce update."
        },
        {
          "path": ".reference-haskell-cardano-node/deps/cardano-ledger/libs/cardano-protocol-tpraos/src/Cardano/Protocol/TPraos/Rules/Tickn.hs",
          "role": "TICKN rule: epoch-boundary nonce transition."
        },
        {
          "path": ".reference-haskell-cardano-node/deps/cardano-ledger/libs/cardano-ledger-core/src/Cardano/Ledger/BaseTypes.hs",
          "role": "hashVerifiedVRF (TPraos) baseline."
        }
      ],
      "rust_surface": [
        {
          "path": "crates/consensus/src/nonce.rs",
          "role": "Module shell + tests + 6-item re-export (NonceDerivation, derive_vrf_nonce, NonceEvolutionConfig, NonceEvolutionState, etc)."
        },
        {
          "path": "crates/consensus/src/nonce/derivation.rs",
          "role": "VRF-output-to-nonce: TPraos hashVerifiedVRF + Praos vrfNonceValue."
        },
        {
          "path": "crates/consensus/src/nonce/evolution.rs",
          "role": "NonceEvolutionConfig + NonceEvolutionState + UPDN/TICKN apply_block + chain-dep-state CBOR sidecar."
        }
      ],
      "implemented_evidence": [
        "R273b split nonce.rs (832 lines) into nonce/{derivation,evolution}.rs mirroring TPraos.Rules.Updn / Rules.Tickn / BaseTypes layout.",
        "Byron/Shelley extra-entropy transition path covered with a regression test pinning the R263 fix.",
        "Chain-dep-state CBOR encode/decode round-trips through the persisted sidecar at every epoch boundary."
      ],
      "remaining_work": [
        "R267: per-epoch byte-match against upstream cardano-node 11.0.1 chain-dep-state sidecar across at least one mainnet epoch transition."
      ],
      "acceptance": [
        "Zero nonce divergence across one full mainnet epoch boundary vs upstream 11.0.1.",
        "Persisted chain-dep-state sidecar bytes match upstream's volatile-DB snapshot byte-for-byte."
      ]
    },
    {
      "id": "consensus.opcert.counter-rule",
      "area": "consensus",
      "feature": "Operational certificate counter validation: pre-Vasil (TPraos) lower-bound only, post-Vasil (Praos) tightened bounds",
      "status": "implemented_needs_11_0_1_evidence",
      "next_milestone": "R267",
      "haskell_reference": [
        {
          "path": ".reference-haskell-cardano-node/deps/cardano-ledger/libs/cardano-protocol-tpraos/src/Cardano/Protocol/TPraos/OCert.hs",
          "role": "OCert struct + KES period helpers (kesPeriod, checkKESPeriod)."
        },
        {
          "path": ".reference-haskell-cardano-node/deps/cardano-ledger/libs/cardano-protocol-tpraos/src/Cardano/Protocol/TPraos/Rules/OCert.hs",
          "role": "TPraos OCERT rule (Shelley/Allegra/Mary/pre-Babbage counter validation)."
        },
        {
          "path": ".reference-haskell-cardano-node/deps/ouroboros-consensus/ouroboros-consensus-protocol/src/ouroboros-consensus-protocol/Ouroboros/Consensus/Protocol/Praos.hs",
          "role": "Praos OCERT rule (Babbage+ Vasil HF tightened bounds)."
        }
      ],
      "rust_surface": [
        {
          "path": "crates/consensus/src/ocert.rs",
          "role": "Module shell + tests + 5-item re-export (OpCert, OcertCounters, OcertCounterRule, kes_period_of_slot, check_kes_period)."
        },
        {
          "path": "crates/consensus/src/ocert/ocert.rs",
          "role": "OpCert struct + KES period helpers."
        },
        {
          "path": "crates/consensus/src/ocert/rules_ocert.rs",
          "role": "OcertCounters + OcertCounterRule (TPraos vs Praos) + CBOR sidecar."
        }
      ],
      "implemented_evidence": [
        "R273c split opcert.rs (856 lines) into opcert/{cert,counter}.rs.",
        "OcertCounterRule::for_pv_major selects TPraos for PV<7 and Praos for PV>=7 — Vasil HF fork-point.",
        "Counter validation tests cover both rules with regression vectors."
      ],
      "remaining_work": [
        "R267: forensic ledger-state diff at the Vasil-HF block (mainnet PV major 7 transition) to confirm the rule-switch matches upstream.",
        "Mainnet 24h+ endurance to certify the post-Vasil tightened-bound rule under live block production."
      ],
      "acceptance": [
        "Per-block OcertCounters byte-match against upstream chain-dep-state sidecar across the Vasil HF boundary.",
        "Zero counter-validation divergence across one mainnet epoch."
      ]
    },
    {
      "id": "consensus.mempool.queue",
      "area": "mempool",
      "feature": "Fee-ordered mempool queue with TTL eviction, capacity overflow with strictly-lower-fee eviction, ledger revalidation",
      "status": "implemented_needs_11_0_1_evidence",
      "next_milestone": "R267",
      "haskell_reference": [
        {
          "path": ".reference-haskell-cardano-node/deps/ouroboros-consensus/ouroboros-consensus/src/ouroboros-consensus/Ouroboros/Consensus/Mempool.hs",
          "role": "Top-level mempool wrapper."
        },
        {
          "path": ".reference-haskell-cardano-node/deps/ouroboros-consensus/ouroboros-consensus/src/ouroboros-consensus/Ouroboros/Consensus/Mempool/API.hs",
          "role": "Mempool API (snapshot, addTxs, removeTxs)."
        }
      ],
      "rust_surface": [
        {
          "path": "crates/consensus/src/mempool.rs",
          "role": "Module wrapper + cross-module re-exports."
        },
        {